[
  {
    "id": "roleplay.new-colleague",
    "goals": ["work", "conversation"], "contexts": ["workplace"],
    "scenario": "new-colleague",
    "level": "A1",
    "character": {
      "role": "Alex, um colega simpático que está se apresentando."
    },
    "objectives": [
      "say-name",
      "say-city",
      "say-profession",
      "ask-name"
    ],
    "constraints": {
      "maxVocabularyLevel": "A1",
      "allowHints": true
    }
  },
  {
    "id": "roleplay.cafe",
    "goals": ["travel", "conversation"], "contexts": ["food_and_drink"],
    "scenario": "cafe",
    "level": "A1",
    "character": {
      "role": "Uma pessoa que atende no balcão."
    },
    "objectives": [
      "greet",
      "order",
      "ask-price",
      "thank"
    ],
    "constraints": {
      "maxVocabularyLevel": "A1",
      "allowHints": true
    }
  },
  {
    "id": "roleplay.directions",
    "goals": ["travel"], "contexts": ["getting_around"],
    "scenario": "directions",
    "level": "A1",
    "character": {
      "role": "Lucía, uma moradora disposta a ajudar."
    },
    "objectives": [
      "ask-station",
      "ask-distance",
      "thank-directions"
    ],
    "constraints": {
      "maxVocabularyLevel": "A1",
      "allowHints": true
    }
  },
  {
    "id": "roleplay.market",
    "goals": ["travel"], "contexts": ["food_and_drink"],
    "scenario": "market",
    "level": "A1",
    "character": {
      "role": "Diego, vendedor de frutas."
    },
    "objectives": [
      "request-fruit",
      "ask-market-price",
      "finish-purchase"
    ],
    "constraints": {
      "maxVocabularyLevel": "A1",
      "allowHints": true
    }
  },
  {
    "id": "roleplay.hotel",
    "goals": ["travel"], "contexts": ["getting_around"],
    "scenario": "hotel",
    "level": "A1",
    "character": {
      "role": "Sofía, recepcionista do hotel."
    },
    "objectives": [
      "confirm-reservation",
      "say-reservation-name",
      "ask-room"
    ],
    "constraints": {
      "maxVocabularyLevel": "A1",
      "allowHints": true
    }
  },
  {
    "id": "roleplay.restaurant",
    "goals": ["travel"], "contexts": ["food_and_drink"],
    "scenario": "restaurant",
    "level": "A1",
    "character": {
      "role": "Mateo, atendente do restaurante."
    },
    "objectives": [
      "request-table",
      "ask-menu",
      "order-dinner"
    ],
    "constraints": {
      "maxVocabularyLevel": "A1",
      "allowHints": true
    }
  }
]
